<?xml version="1.0" encoding="Windows-1251" standalone="no"?>
<LVData xsi:noNamespaceSchemaLocation="file:///C:/Users/Àíæåëèêà/Downloads/SYaRd/ÑßÐä/lab6/test-schema.xsd" xmlns:xsi="http://www.w3.org/2001/XMLSchema-instance">
<Version>16.0</Version>
<Cluster>
<Name/>
<NumElts>4</NumElts>
<DBL>
<Name/>
<Val>0.00000000000000</Val>
</DBL>
<DBL>
<Name/>
<Val>0.50000000000000</Val>
</DBL>
<String>
<Name/>
<Val>14.12.2018</Val>
</String>
<String>
<Name/>
<Val>09:23:12</Val>
</String>
</Cluster>
<Cluster>
<Name/>
<NumElts>4</NumElts>
<DBL>
<Name/>
<Val>0.00000000000000</Val>
</DBL>
<DBL>
<Name/>
<Val>0.50000000000000</Val>
</DBL>
<String>
<Name/>
<Val>14.12.2018</Val>
</String>
<String>
<Name/>
<Val>09:23:16</Val>
</String>
</Cluster>
<Cluster>
<Name/>
<NumElts>4</NumElts>
<DBL>
<Name/>
<Val>1.00000000000000</Val>
</DBL>
<DBL>
<Name/>
<Val>0.50000000000000</Val>
</DBL>
<String>
<Name/>
<Val>14.12.2018</Val>
</String>
<String>
<Name/>
<Val>09:23:22</Val>
</String>
</Cluster>
</LVData>


